{
  "name": "ship-go-nogo",
  "layer": "atomic",
  "family": "release",
  "job_type": "ship-go-nogo",
  "description": "Use when assessing release safety, rollout risk, compatibility impact, and rollback readiness. This is the renamed release judgement skill; use it for GO/NO-GO analysis, not for publication execution.",
  "purpose": "Judge release safety and rollback readiness.",
  "when_to_use": [
    "Need rollout, blast-radius, or rollback judgement before release.",
    "Need GO/NO-GO decision grounded in release evidence.",
    "Need rollout, interface, and monitoring checks before deployment."
  ],
  "do_not_use": [
    "Need direct implementation or bug debugging.",
    "Need only repository or docs hygiene checks.",
    "Need actual branch, tag, or release publication execution."
  ],
  "required_inputs": [
    {
      "name": "RELEASE_SCOPE",
      "type": "diff|repo|deployment-slice",
      "required": true,
      "description": "Release scope under evaluation."
    },
    {
      "name": "ROLLOUT_PLAN",
      "type": "string",
      "required": true,
      "description": "Intended rollout path."
    },
    {
      "name": "ROLLBACK_PATH",
      "type": "string",
      "required": true,
      "description": "Rollback or stop strategy."
    },
    {
      "name": "KNOWN_GATES",
      "type": "list",
      "required": false,
      "shape": "{GATE, STATUS, EVIDENCE}",
      "description": "Known tests, docs, approval, compatibility, or security signals."
    }
  ],
  "input_contract_notes": [
    "RELEASE_SCOPE should stay bounded to the actual release candidate under consideration.",
    "ROLLOUT_PLAN and ROLLBACK_PATH should describe real operational paths, not aspirational placeholders.",
    "KNOWN_GATES should cite observable gate evidence rather than predicted success."
  ],
  "structured_outputs": [
    {
      "name": "BLAST_RADIUS",
      "type": "string",
      "required": true,
      "description": "Affected users, systems, or consumer radius."
    },
    {
      "name": "ROLLBACK_CHECKLIST",
      "type": "list",
      "required": true,
      "shape": "{STEP, PURPOSE}",
      "description": "Rollback conditions and procedure."
    },
    {
      "name": "RELEASE_DECISION",
      "type": "go|no-go|blocked",
      "required": true,
      "allowed_values": [
        "go",
        "no-go",
        "blocked"
      ],
      "description": "Go, no-go, or blocked decision with rationale."
    }
  ],
  "output_contract_notes": [
    "RELEASE_DECISION should remain blocked when a required gate is unresolved rather than optimistic by default.",
    "ROLLBACK_CHECKLIST should describe actual recovery steps, not generic rollback slogans.",
    "BLAST_RADIUS should reflect the real release slice and consumer impact."
  ],
  "artifacts_in": [],
  "artifacts_out": [
    "release-decision.v1"
  ],
  "neutrality_rules": [
    "Separate observed release evidence from GO/NO-GO judgement.",
    "If rollback or monitoring evidence is missing, mark the decision as blocked.",
    "Do not imply release readiness when approval or safety gates are unresolved."
  ],
  "execution_constraints": [
    "Do not mutate branches, tags, remotes, or release hosts from this skill.",
    "Keep rollout and rollback judgement explicit and evidence-backed.",
    "Do not convert hygiene or repository precondition gaps into hidden assumptions."
  ],
  "response_profile": "release_decision",
  "default_prompt": "$ship-go-nogo",
  "default_program": "[stages: preflight>detect>analyze>plan>review>handoff>audit |\n scope: diff|repo |\n policy: evidence,safety-gates,quality-gates{compat,docs,security,tests},deterministic-output |\n lens: release-gatekeeper |\n output: md(contract=v1)]",
  "explicit_only": false,
  "source_path": "skills/ship-go-nogo",
  "primary_lens": "release-gatekeeper",
  "lens_rationale": "Release decisions should center on blast radius, rollback readiness, and delivery stability signals."
}
