{
  "name": "debug-find-root-cause",
  "layer": "atomic",
  "family": "analysis",
  "job_type": "debug-find-root-cause",
  "description": "Neutral debugging skill for concrete failures. Use when a concrete failure, bug, or crash requires reproducible debugging and root-cause analysis. Do not use when feature implementation, broad design planning, or non-failure analysis is the primary intent. English triggers: debug, crash analysis, root-cause.",
  "purpose": "Reproduce a concrete failure, confirm root cause, and isolate the minimal fix path.",
  "when_to_use": [
    "A concrete failure exists and reproducible RCA is required.",
    "Need to move from symptom to confirmed cause and minimal fix direction.",
    "Need regression guard planning after a real bug fix."
  ],
  "do_not_use": [
    "The request is exploratory with no concrete failure.",
    "The request is feature implementation.",
    "The immediate job is only to reduce failure surface."
  ],
  "required_inputs": [
    {
      "name": "FAILURE_SYMPTOM",
      "type": "string",
      "required": true,
      "description": "Observed failure symptom."
    },
    {
      "name": "TARGET_SCOPE",
      "type": "file|module|command|test|repo",
      "required": true,
      "description": "Scope in which the failure appears."
    },
    {
      "name": "EXPECTED_BEHAVIOR",
      "type": "string",
      "required": true,
      "description": "What should have happened."
    },
    {
      "name": "REPRO_STATUS",
      "type": "yes|no|partial",
      "required": true,
      "description": "Whether a reproduction already exists."
    },
    {
      "name": "KNOWN_EVIDENCE",
      "type": "list",
      "required": false,
      "shape": "{TYPE, REF, WHY_RELEVANT}",
      "description": "Stack traces, logs, failing tests, or repro commands."
    }
  ],
  "input_contract_notes": [
    "FAILURE_SYMPTOM should describe the observed failure, not a guessed cause.",
    "EXPECTED_BEHAVIOR should be concrete enough to distinguish pass from fail during reproduction.",
    "KNOWN_EVIDENCE should cite observed traces, logs, or failing checks only; do not preload a root-cause conclusion into the evidence list."
  ],
  "structured_outputs": [
    {
      "name": "REPRO_STEPS",
      "type": "list",
      "required": true,
      "shape": "{STEP, PURPOSE, EXPECTED_SIGNAL}",
      "description": "Cheapest reproduction steps."
    },
    {
      "name": "OBSERVED_VS_EXPECTED",
      "type": "object",
      "required": true,
      "description": "Observed behavior versus expected behavior."
    },
    {
      "name": "CONFIRMED_CAUSE",
      "type": "string",
      "required": true,
      "description": "Confirmed root cause or inconclusive result."
    },
    {
      "name": "MINIMAL_FIX_DIRECTION",
      "type": "string",
      "required": true,
      "description": "Narrow fix path."
    },
    {
      "name": "REGRESSION_GUARD",
      "type": "list",
      "required": true,
      "shape": "{GUARD, PURPOSE, STATUS}",
      "description": "Regression guard or repro harness to leave behind."
    }
  ],
  "output_contract_notes": [
    "CONFIRMED_CAUSE may explicitly be `inconclusive` when reproduction or evidence cannot isolate the cause.",
    "MINIMAL_FIX_DIRECTION should become a next-investigation direction rather than a guessed patch when the cause is still unconfirmed.",
    "REPRO_STEPS and OBSERVED_VS_EXPECTED should stay grounded in concrete signals, not retrospective theory."
  ],
  "artifacts_in": [
    "debug-map-blast-radius.v1"
  ],
  "artifacts_out": [
    "debug-report.v1"
  ],
  "neutrality_rules": [
    "Do not assume the first plausible cause is the root cause.",
    "If reproduction is missing, say repro-missing rather than guessing the fix.",
    "Separate symptom, cause hypothesis, and confirmed cause."
  ],
  "execution_constraints": [
    "Do not claim a confirmed cause until the observed evidence discriminates it from plausible alternatives.",
    "If the evidence cannot isolate the cause, keep the result inconclusive and return the cheapest next discriminating check.",
    "Do not implement or recommend a confident fix path solely to satisfy a bug-fix request when the root cause is still unconfirmed."
  ],
  "response_profile": "debug_report",
  "default_prompt": "$debug-find-root-cause",
  "default_program": "[stages: preflight>detect>analyze>implement>verify>audit |\n scope: diff |\n lens: feynman |\n output: md(contract=v1)]",
  "explicit_only": false,
  "source_path": "skills/debug-find-root-cause",
  "split_candidates": [
    "debug-map-blast-radius",
    "check-failure-paths",
    "test-find-gaps"
  ],
  "primary_lens": "feynman",
  "lens_rationale": "Debugging should reproduce first, test hypotheses, and explain the confirmed cause plainly."
}
