{
  "name": "check-merge-ready",
  "layer": "atomic",
  "family": "check-merge-ready",
  "job_type": "check-merge-ready",
  "description": "Neutral review-only verdict skill. Produce findings-first PR/code review with severity, confidence, file/line evidence, testing gaps, and integrate/hold judgement. Use for general review, PR review, and /review-style checks. For mandatory 9-item checklist evaluation, compose with check-quality-scan; for gate-centric release risk judgement, compose with audit. Do not edit code or create implementation plans here. English triggers: review, code review, PR review, /review, review verdict.",
  "purpose": "Issue a findings-first review verdict with evidence.",
  "when_to_use": [
    "Need a final findings-first review verdict.",
    "Need prioritized review findings with file/line evidence.",
    "Need integrate/hold judgement after reviewing changed code."
  ],
  "do_not_use": [
    "Need direct code implementation.",
    "Need only the 9-item checklist without verdict synthesis.",
    "Need a narrow single-concern scan instead of a broad review verdict."
  ],
  "required_inputs": [
    {
      "name": "REVIEW_GOAL",
      "type": "general-verdict|regression-risk|change-intent-check|narrow-focus",
      "required": true,
      "allowed_values": [
        "general-verdict",
        "regression-risk",
        "change-intent-check",
        "narrow-focus"
      ],
      "description": "Type of review verdict needed."
    },
    {
      "name": "TARGET_SCOPE",
      "type": "diff|file|module|folder|repo",
      "required": true,
      "description": "Scope to review."
    },
    {
      "name": "CHANGE_INTENT",
      "type": "string",
      "required": true,
      "description": "Claimed purpose of the change."
    },
    {
      "name": "KNOWN_TEST_SIGNAL",
      "type": "list",
      "required": false,
      "shape": "{SIGNAL, STATUS, SOURCE}",
      "description": "Executed tests, missing tests, or CI status."
    },
    {
      "name": "CONSTRAINTS",
      "type": "list",
      "required": false,
      "shape": "{CONSTRAINT}",
      "description": "Security-only, perf-only, compat-only, or other focused constraints."
    }
  ],
  "input_contract_notes": [
    "CHANGE_INTENT should summarize the claimed purpose of the change, not the reviewer verdict.",
    "KNOWN_TEST_SIGNAL should distinguish executed evidence from missing or assumed coverage.",
    "Use REVIEW_GOAL=narrow-focus only when constraints clearly bound the inspection surface."
  ],
  "structured_outputs": [
    {
      "name": "FINDINGS",
      "type": "list",
      "required": true,
      "shape": "{SEVERITY, SUMMARY, LOCATION, EVIDENCE, CONFIDENCE}",
      "description": "Concrete findings with severity, confidence, and evidence."
    },
    {
      "name": "TESTING_GAPS",
      "type": "list",
      "required": true,
      "shape": "{GAP, IMPACT, CHEAPEST_CHECK}",
      "description": "Testing gaps plus cheapest verification steps."
    },
    {
      "name": "VERDICT",
      "type": "integrate|hold",
      "required": true,
      "allowed_values": [
        "integrate",
        "hold"
      ],
      "description": "Integrate or hold verdict with rationale."
    }
  ],
  "output_contract_notes": [
    "Each FINDINGS row should cite concrete evidence and keep severity separate from confidence.",
    "Use TESTING_GAPS for missing verification coverage even when no code defect is proven.",
    "VERDICT should summarize the practical merge stance after findings and testing gaps are considered."
  ],
  "artifacts_in": [],
  "artifacts_out": [
    "review-report.v1"
  ],
  "neutrality_rules": [
    "Do not assume a finding exists; return no findings when evidence does not support one.",
    "Separate observed behavior from inferred impact.",
    "Do not convert maintainability preference into a blocker unless a concrete regression or risk exists."
  ],
  "execution_constraints": [
    "Review is read-and-judge only; do not patch code or rewrite planning artifacts here.",
    "If evidence is insufficient to support a finding, downgrade it to a testing gap or inconclusive note instead of overstating impact.",
    "Keep the verdict tied to the supplied scope and change intent rather than repo-wide preference debates."
  ],
  "response_profile": "review_findings",
  "default_prompt": "$check-merge-ready",
  "default_program": "[stages: preflight>detect>analyze>review>handoff>audit |\n scope: diff |\n policy: evidence,quality-gates{tests,security,compat,style},deterministic-output |\n lens: kahneman-tversky |\n output: md(contract=v1)]",
  "explicit_only": false,
  "source_path": "skills/check-merge-ready",
  "split_candidates": [
    "tidy-find-magic-numbers",
    "tidy-find-copies",
    "check-module-walls",
    "check-failure-paths",
    "test-find-gaps"
  ],
  "primary_lens": "kahneman-tversky",
  "lens_rationale": "Review verdicts should separate observed defects from inferred impact and mark uncertainty explicitly."
}
